interview_id,participant_id,customer_industry,customer_job_title,company_size,environment,segment_text,segment_type
I001,P01,financial_services,Senior Account Manager,large,executive_boardroom,"When I stepped into the boardroom I immediately sat differently. There is something about the dark wood and the leather that made me feel like I needed to perform. It is like the material is telling you this is serious. I could absolutely use this for a client presentation but I would not want to be in there for a creative session because that needs a different energy. The ceiling height is also doing something - it feels just slightly too low and combined with the dark materials it created a mild pressure.",emotional_narrative
I002,P01,financial_services,Senior Account Manager,large,nature_space,"The natural light in this one is genuinely the best thing I have seen in VR. I kept having to remind myself I was not in a real room. That is not just a compliment - it is saying something important about what natural light does to your sense of presence. I felt calm and genuinely present. I could have a long session in here without the fatigue that normally builds up. The greenery is a little intense but the light is extraordinary.",emotional_narrative
I003,P02,technology,VP of Sales,large,executive_boardroom,"I like the gravitas. For certain types of meetings - strategic reviews client pitches anything where you want people to bring their A game - this environment is doing work that you would normally rely on physical architecture to do. The dark wood is telling people what kind of conversation this is. That is actually a fascinating capability of VR that we should lean into more deliberately.",occasion_mapping
I004,P02,technology,VP of Sales,large,futuristic_tech,"This feels native to the medium. It does not try to simulate the real world - it commits to being something only VR can be. I find that genuinely exciting. Some people find it cold and alienating and I understand that intellectually but for me this is what the technology should be doing. I would use this for any technical or strategic meeting where I want the environment to signal innovation.",emotional_narrative
I005,P03,healthcare,Patient Experience Director,large,residential_warm,"The warmth is real. I felt it immediately. The textures are beautiful and there is something about the domestic scale that reduces the formality enough to make difficult conversations easier. I am thinking about this specifically in the context of sensitive discussions where psychological safety matters. The living room says this is a safe space in a way that the boardroom never could. The problem is it also says you can relax in a way that undermines productivity for task-focused work.",dual_response
I006,P03,healthcare,Patient Experience Director,large,clean_studio,"It is blank. Deliberately and functionally blank. For a quick structured meeting I can see why this works - there is nothing competing for attention. But I kept feeling like something was missing. Not a specific thing - just texture weight the sense that someone made this place. It felt like being inside a template.",emotional_narrative
I007,P04,media,Head of Strategy,large,city_loft,"This is where I would do every creative brief. The city view gives energy without being aggressive about it. The industrial materials are honest - they are not trying to pretend to be something else. When I think about the kinds of conversations I want to have here - campaign planning creative reviews pitch prep - this space is doing exactly the right thing. It feels like being in a good studio.",occasion_mapping
I008,P04,media,Head of Strategy,large,futuristic_tech,"I appreciate it aesthetically but it makes me feel like a prop. Like I am standing inside someone else's tech demo rather than having a real conversation. There is a detachment that I find genuinely difficult to overcome. After about five minutes I stopped noticing the impressive visuals and started feeling vaguely uneasy without knowing why. I think it is the absence of any organic or imperfect element. Everything is too resolved.",emotional_narrative
I009,P05,consulting,Executive Coach,small,nature_space,"The thing that struck me most was that this was the first environment where I forgot I was in VR. Not because it was photorealistic - it was not - but because the natural light was so convincing that my nervous system just settled. That is a significant finding. Every other space reminded me I was in a headset. This one let me be in a conversation.",presence_response
I010,P05,consulting,Executive Coach,small,residential_warm,"For a sensitive conversation - a difficult coaching session a first meeting with a new client who is anxious about the medium - this environment is doing something no physical office can easily replicate. It says we are having this conversation in a human context. The warmth is not just aesthetic. It is relational. The problem is that it reads so clearly as domestic that it undermines professional credibility in contexts where that matters.",dual_response
I011,P06,technology,CTO,large,clean_studio,"This is the only one I could work in all day. The others are interesting as experiences but they are all slightly too much. This one gets out of the way. I am not exploring the space I am in the meeting. That is what I want from a work environment - maximum transparency. The sterile feeling some people describe is exactly what I find functional.",emotional_narrative
I012,P06,technology,CTO,large,city_loft,"The industrial honesty appeals to me more than the nature simulation. This is clearly a made environment but it is a good one. The city view gives a sense of being connected to something larger without trying to pass itself off as real. I could work here for a creative session. The long session focus problem is real though - after about an hour the city view becomes a source of rumination rather than energy.",session_length
I013,P07,professional_services,HR Director,large,residential_warm,"Beautiful materials. The warmth is immediately affecting. But the occasion mismatch is a real problem. When I tried to imagine having a formal review in here I almost laughed. The space is saying something that contradicts professional authority entirely. For a sensitive HR conversation this would be perfect. For anything external it would undermine you before you had spoken.",occasion_mismatch
I014,P07,professional_services,HR Director,large,city_loft,"The dusk lighting in the city loft is the best designed moment I experienced across all the environments. The combination of the warm industrial interior and the cool blue of the city at dusk creates something genuinely cinematic. I would want to start every creative session at dusk in this space. The problem is consistency - if the lighting changes during a long session it is disorienting.",emotional_narrative
I015,P08,financial_services,Institutional Relationship Manager,large,futuristic_tech,"I understand why some people find this exciting. For an engineering team it probably signals exactly the right things. For me it feels alienating. The geometry is perfect and the ambient glow is beautiful but there is nothing in the space that acknowledges that I am a body with weight and warmth. The executive boardroom intimidates me but at least it has texture. This just makes me feel like a data point.",embodiment_response
I016,P08,financial_services,Institutional Relationship Manager,large,executive_boardroom,"I have mixed feelings. The formality is sometimes exactly right and sometimes completely wrong. For a formal client review this environment would make the conversation feel appropriately serious. For the same conversation delivered badly it would feel brutal. The environment is amplifying whatever the meeting is rather than softening it. That might be a feature or a problem depending on the use case.",dual_response
I017,P09,media,Managing Director,large,city_loft,"The creative energy is the highest of any environment I experienced. The tension between being inside and the city outside creates a productive restlessness. I find myself wanting to make something propose something. The session length issue is genuine - I think there should be a focus mode that reduces the city view intensity. But as a default for creative work this is the strongest environment in the set.",occasion_mapping
I018,P09,media,Managing Director,large,clean_studio,"It is interesting that the most controversial environment is also in some ways the most functional one. The clients who dislike it find it sterile. The clients who find it useful find it liberating. When the space disappears you can concentrate fully on the people and the ideas. That is actually the goal of a meeting environment.",split_response
I019,P10,consulting,Brand Strategist,small,nature_space,"The natural light changed something in my body that I did not expect. I was less tense. I stopped checking the time. I was genuinely present in a way that I am not in most VR sessions. I do not know exactly what the light is doing but whatever it is every environment should have it. Not just this one - all of them.",presence_response
I020,P10,consulting,Brand Strategist,small,executive_boardroom,"This environment is doing something very specific and it does it well. It is creating the spatial conditions for a serious conversation. Whether you want a serious conversation is a different question. I would use this for a business review. I would not use it for anything where vulnerability or creativity is required. The space has decided what kind of conversation you are having before anyone speaks.",occasion_mapping
